{
  "schema_version": 1,
  "title": "Release check · v0.27.6",
  "repo": "backnotprop/plannotator",
  "commit": "c41d9e7",
  "ran_at": "2026-08-26T16:20:00Z",
  "mode": "list",
  "list_source": ".product/qa-list.md",
  "selection": "selective",
  "selection_basis": "diff main...HEAD, 14 files",
  "notes": "Browser items ran against the local server on the HTML and live-site targets. Docs site unreachable offline.",
  "items": [
    {
      "id": "annotate-html-headless",
      "title": "Annotating HTML works headlessly",
      "check_type": "browser",
      "status": "fail",
      "summary": "Opened article.html through the local server, selected paragraph 2, added a comment, applied a quick tag, submitted. The quick-tags popover did not open on the live-site target; the other two targets passed.",
      "findings": [
        { "severity": "high", "text": "Quick-tags popover stays closed on the live-site target; the click handler is attached before the toolbar mounts.", "evidence": "apps/annotate/src/Toolbar.tsx:118" },
        { "severity": "low", "text": "Comment highlight lags one frame behind the selection on the markdown target.", "evidence": "recording 0:10" }
      ],
      "media": {
        "video": "recording.mp4",
        "checkpoints": [
          { "t": 1, "label": "Page loads", "narration": "article.html opens through the local server; no console errors.", "screenshot": "cp-1.png" },
          { "t": 4, "label": "Toolbar renders", "narration": "All four key buttons present on the HTML target.", "screenshot": "cp-4.png" },
          { "t": 10, "label": "Comment added", "narration": "Selecting paragraph 2 and commenting produces the highlight and a stored annotation.", "screenshot": "cp-10.png" },
          { "t": 16, "label": "Quick tag applied", "narration": "The tag attaches on the HTML target; on the live-site target the popover never opened.", "screenshot": "cp-16.png" },
          { "t": 21, "label": "Feedback submitted", "narration": "Submit succeeds; the payload contains the comment and, on two of three targets, the tag.", "screenshot": "cp-21.png" }
        ]
      },
      "checked_by": "opus · browser"
    },
    {
      "id": "remote-urls-rewritten",
      "title": "Remote URLs are rewritten to the local server",
      "check_type": "code",
      "status": "fail",
      "summary": "Traced the URL rewrite from the CLI flag to the fetch layer. The rewrite skips URLs with a port, so http://localhost:3000 targets are fetched directly.",
      "findings": [
        { "severity": "high", "text": "rewriteRemote() matches on hostname only and returns early when the URL carries a port.", "evidence": "packages/cli/src/rewrite.ts:41" }
      ],
      "checked_by": "sonnet · code"
    },
    {
      "id": "bun-pinned",
      "title": "Bun is still pinned to 1.3.x",
      "check_type": "code",
      "status": "flag",
      "summary": "The packageManager field is unchanged, but bun.lock moved from 1.3.9 to 1.3.11 in this change set. The list says no naive upgrades; this one came in with a dependency bump.",
      "findings": [
        { "severity": "medium", "text": "bun.lock records 1.3.11; the last tag records 1.3.9. Decide whether the bump is intended.", "evidence": "git diff v0.27.5 -- bun.lock" }
      ],
      "checked_by": "sonnet · code"
    },
    {
      "id": "config-schema-change",
      "title": "A change touches the config schema",
      "check_type": "code",
      "status": "flag",
      "summary": "Always-flag rule. The change set adds an optional field to config.schema.json; existing configs still validate.",
      "findings": [
        { "severity": "info", "text": "New optional field annotate.quickTags; default preserves current behavior.", "evidence": "packages/core/config.schema.json:88" }
      ],
      "checked_by": "sonnet · code"
    },
    {
      "id": "toolbar-buttons-present",
      "title": "Every toolbar button is present",
      "check_type": "browser",
      "status": "pass",
      "summary": "All four key buttons are present on markdown, HTML, and live-site targets. Recorded on the HTML target; the other two checked by DOM assertion.",
      "findings": [
        { "severity": "info", "text": "Button set unchanged from v0.27.5: comment, thumbs up, quick tags, submit.", "evidence": "apps/annotate/src/Toolbar.tsx:41" }
      ],
      "media": {
        "video": "recording.mp4",
        "checkpoints": [
          { "t": 1, "label": "Page loads", "narration": "article.html opens through the local server.", "screenshot": "cp-1.png" },
          { "t": 4, "label": "Toolbar renders", "narration": "All four key buttons present.", "screenshot": "cp-4.png" }
        ],
        "screenshots": [
          { "path": "cp-4.png", "caption": "markdown target" },
          { "path": "cp-16.png", "caption": "live-site target" }
        ]
      },
      "checked_by": "opus · browser"
    },
    {
      "id": "diff-loads-2mb",
      "title": "The diff loads on a 2MB file",
      "check_type": "browser",
      "status": "pass",
      "summary": "Loaded the 2.1MB fixture diff; first paint at 1.4s, scroll stayed responsive, no console errors.",
      "media": {
        "screenshots": [
          { "path": "cp-10.png", "caption": "2.1MB fixture, fully rendered" }
        ]
      },
      "checked_by": "opus · browser"
    },
    {
      "id": "prompt-cache-preserved",
      "title": "Prompt cache prefix is preserved",
      "check_type": "code",
      "status": "pass",
      "summary": "The system prompt assembly order is unchanged; the cache-control marker still sits after the static prefix.",
      "findings": [
        { "severity": "info", "text": "assemblePrompt() emits the static prefix first, then the marker, then per-turn content.", "evidence": "packages/core/src/prompt.ts:57" }
      ],
      "checked_by": "sonnet · code"
    },
    {
      "id": "install-paths-diverge",
      "title": "The install script still targets both paths",
      "check_type": "code",
      "status": "pass",
      "summary": "install.sh writes to both the Pi and the OpenCode locations; both branches are exercised by the install test.",
      "findings": [
        { "severity": "info", "text": "Both targets present and tested.", "evidence": "install/install.sh:22" }
      ],
      "checked_by": "sonnet · code"
    },
    {
      "id": "docs-staleness",
      "title": "Docs match the shipped flags",
      "check_type": "code",
      "status": "skipped",
      "summary": "The docs site was unreachable offline, so the shipped flags could not be compared against the published pages.",
      "checked_by": "sonnet · code"
    },
    {
      "id": "supply-chain-versions",
      "title": "Dependency versions match the allowlist",
      "check_type": "code",
      "status": "not-run",
      "summary": "Dependencies unchanged since v0.27.5, apart from the Bun bump flagged above.",
      "checked_by": "orchestrator"
    },
    {
      "id": "pi-install-path",
      "title": "Pi install path resolves",
      "check_type": "code",
      "status": "not-run",
      "summary": "No change under install/.",
      "checked_by": "orchestrator"
    },
    {
      "id": "opencode-install-path",
      "title": "OpenCode install path resolves",
      "check_type": "code",
      "status": "not-run",
      "summary": "No change under install/.",
      "checked_by": "orchestrator"
    },
    {
      "id": "keyboard-nav-annotate",
      "title": "Keyboard navigation through annotations",
      "check_type": "browser",
      "status": "not-run",
      "summary": "No change under apps/annotate/src/keyboard/.",
      "checked_by": "orchestrator"
    }
  ]
}
