{
  "schema_version": 1,
  "title": "Verify · annotate toolbar",
  "repo": "backnotprop/plannotator",
  "commit": "a91c4e2",
  "ran_at": "2026-08-26T14:40:00Z",
  "mode": "feature",
  "list_source": null,
  "items": [
    {
      "id": "toolbar-integrity",
      "title": "Annotate toolbar integrity",
      "check_type": "browser",
      "status": "pass",
      "summary": "All key buttons are present on markdown, HTML, and live-site targets. Recorded on the HTML target; the other two were checked by DOM assertion.",
      "findings": [
        { "severity": "info", "text": "Button set is unchanged from v0.17.5: comment, thumbs up, quick tags, submit.", "evidence": "apps/annotate/src/Toolbar.tsx:41" },
        { "severity": "low", "text": "Quick-tags popover opens 40ms slower on the live-site target than on markdown; within budget.", "evidence": "recording 0:16" }
      ],
      "media": {
        "video": "recording.mp4",
        "checkpoints": [
          { "t": 1,  "label": "Page loads",         "narration": "article.html opens through the local server; no console errors.", "screenshot": "cp-1.png" },
          { "t": 4,  "label": "Toolbar renders",    "narration": "All four key buttons present: comment, thumbs up, quick tags, submit.", "screenshot": "cp-4.png" },
          { "t": 10, "label": "Comment added",      "narration": "Selecting paragraph 2 and commenting produces the highlight and a stored annotation.", "screenshot": "cp-10.png" },
          { "t": 16, "label": "Quick tag applied",  "narration": "needs-work tag attaches to the annotation; the chip renders.", "screenshot": "cp-16.png" },
          { "t": 21, "label": "Feedback submitted", "narration": "Submit succeeds; the payload contains both the comment and the tag.", "screenshot": "cp-21.png" }
        ],
        "screenshots": [
          { "path": "cp-4.png", "caption": "markdown target — toolbar" },
          { "path": "cp-16.png", "caption": "live site — quick tags" }
        ]
      },
      "checked_by": "opus · browser"
    }
  ]
}
